{
  "$schema": "http://json-schema.org/draft-07/schema#",
  "title": "Termy Theme Colors",
  "type": "object",
  "required": [
    "foreground",
    "background",
    "cursor",
    "black",
    "red",
    "green",
    "yellow",
    "blue",
    "magenta",
    "cyan",
    "white",
    "bright_black",
    "bright_red",
    "bright_green",
    "bright_yellow",
    "bright_blue",
    "bright_magenta",
    "bright_cyan",
    "bright_white"
  ],
  "properties": {
    "$schema": { "type": "string" },
    "foreground": { "type": "string", "pattern": "^#[0-9a-fA-F]{6}$" },
    "background": { "type": "string", "pattern": "^#[0-9a-fA-F]{6}$" },
    "cursor": { "type": "string", "pattern": "^#[0-9a-fA-F]{6}$" },
    "black": { "type": "string", "pattern": "^#[0-9a-fA-F]{6}$" },
    "red": { "type": "string", "pattern": "^#[0-9a-fA-F]{6}$" },
    "green": { "type": "string", "pattern": "^#[0-9a-fA-F]{6}$" },
    "yellow": { "type": "string", "pattern": "^#[0-9a-fA-F]{6}$" },
    "blue": { "type": "string", "pattern": "^#[0-9a-fA-F]{6}$" },
    "magenta": { "type": "string", "pattern": "^#[0-9a-fA-F]{6}$" },
    "cyan": { "type": "string", "pattern": "^#[0-9a-fA-F]{6}$" },
    "white": { "type": "string", "pattern": "^#[0-9a-fA-F]{6}$" },
    "bright_black": { "type": "string", "pattern": "^#[0-9a-fA-F]{6}$" },
    "bright_red": { "type": "string", "pattern": "^#[0-9a-fA-F]{6}$" },
    "bright_green": { "type": "string", "pattern": "^#[0-9a-fA-F]{6}$" },
    "bright_yellow": { "type": "string", "pattern": "^#[0-9a-fA-F]{6}$" },
    "bright_blue": { "type": "string", "pattern": "^#[0-9a-fA-F]{6}$" },
    "bright_magenta": { "type": "string", "pattern": "^#[0-9a-fA-F]{6}$" },
    "bright_cyan": { "type": "string", "pattern": "^#[0-9a-fA-F]{6}$" },
    "bright_white": { "type": "string", "pattern": "^#[0-9a-fA-F]{6}$" }
  },
  "additionalProperties": false
}
