{
  "$schema": "../../../schemas/theme.schema.json",
  "background": "#292d3e",
  "black": "#292d3e",
  "blue": "#82aaff",
  "bright_black": "#676e95",
  "bright_blue": "#82aaff",
  "bright_cyan": "#89ddff",
  "bright_green": "#c3e88d",
  "bright_magenta": "#c792ea",
  "bright_red": "#ff5377",
  "bright_white": "#ffffff",
  "bright_yellow": "#ffcb6b",
  "cursor": "#ffcc00",
  "cyan": "#89ddff",
  "foreground": "#959dcb",
  "green": "#c3e88d",
  "magenta": "#c792ea",
  "red": "#ff5377",
  "white": "#959dcb",
  "yellow": "#ffcb6b"
}