{
  "$schema": "../../../schemas/theme.schema.json",
  "background": "#282a36",
  "black": "#21222c",
  "blue": "#bd93f9",
  "bright_black": "#6272a4",
  "bright_blue": "#d6acff",
  "bright_cyan": "#a4ffff",
  "bright_green": "#69ff94",
  "bright_magenta": "#ff92df",
  "bright_red": "#ff6e6e",
  "bright_white": "#ffffff",
  "bright_yellow": "#ffffa5",
  "cursor": "#f8f8f2",
  "cyan": "#8be9fd",
  "foreground": "#f8f8f2",
  "green": "#50fa7b",
  "magenta": "#ff79c6",
  "red": "#ff5555",
  "white": "#f8f8f2",
  "yellow": "#f1fa8c"
}