{
  "$schema": "../../../schemas/theme.schema.json",
  "background": "#1d1f21",
  "black": "#000000",
  "blue": "#81a2be",
  "bright_black": "#969896",
  "bright_blue": "#81a2be",
  "bright_cyan": "#8abeb7",
  "bright_green": "#b5bd68",
  "bright_magenta": "#b294bb",
  "bright_red": "#cc6666",
  "bright_white": "#ffffff",
  "bright_yellow": "#f0c674",
  "cursor": "#aeafad",
  "cyan": "#8abeb7",
  "foreground": "#c5c8c6",
  "green": "#b5bd68",
  "magenta": "#b294bb",
  "red": "#cc6666",
  "white": "#c5c8c6",
  "yellow": "#f0c674"
}