{
  "$schema": "../../../schemas/theme.schema.json",
  "background": "#2e3440",
  "black": "#2e3440",
  "blue": "#81a1c1",
  "bright_black": "#4c566a",
  "bright_blue": "#81a1c1",
  "bright_cyan": "#8fbcbb",
  "bright_green": "#a3be8c",
  "bright_magenta": "#b48ead",
  "bright_red": "#bf616a",
  "bright_white": "#eceff4",
  "bright_yellow": "#ebcb8b",
  "cursor": "#d8dee9",
  "cyan": "#88c0d0",
  "foreground": "#d8dee9",
  "green": "#a3be8c",
  "magenta": "#b48ead",
  "red": "#bf616a",
  "white": "#e5e9f0",
  "yellow": "#ebcb8b"
}