{
  "$schema": "../../../schemas/theme.schema.json",
  "background": "#282828",
  "black": "#282828",
  "blue": "#458588",
  "bright_black": "#928374",
  "bright_blue": "#83a598",
  "bright_cyan": "#8ec07c",
  "bright_green": "#b8bb26",
  "bright_magenta": "#d3869b",
  "bright_red": "#fb4934",
  "bright_white": "#ebdbb2",
  "bright_yellow": "#fabd2f",
  "cursor": "#ebdbb2",
  "cyan": "#689d6a",
  "foreground": "#ebdbb2",
  "green": "#98971a",
  "magenta": "#b16286",
  "red": "#cc241d",
  "white": "#a89984",
  "yellow": "#d79921"
}