{
  "$schema": "../../../schemas/theme.schema.json",
  "background": "#1a1b26",
  "black": "#15161e",
  "blue": "#7aa2f7",
  "bright_black": "#414868",
  "bright_blue": "#7aa2f7",
  "bright_cyan": "#7dcfff",
  "bright_green": "#9ece6a",
  "bright_magenta": "#bb9af7",
  "bright_red": "#f7768e",
  "bright_white": "#c0caf5",
  "bright_yellow": "#e0af68",
  "cursor": "#c0caf5",
  "cyan": "#7dcfff",
  "foreground": "#c0caf5",
  "green": "#9ece6a",
  "magenta": "#bb9af7",
  "red": "#f7768e",
  "white": "#a9b1d6",
  "yellow": "#e0af68"
}